{
  "$schema":"http://json-schema.org/draft-07/schema#","$id":"v3-capability-request","type":"object","additionalProperties":false,
  "properties":{"schema_version":{"const":1},"request_id":{"type":"string","pattern":"^ireq_[A-Za-z0-9-]+$"},"run_id":{"type":"string","minLength":1,"maxLength":120},"task_id":{"type":"string","minLength":1,"maxLength":120},"profile_id":{"type":"string","minLength":1,"maxLength":120},"workflow":{"type":"string","minLength":1,"maxLength":120},"connector_id":{"type":"string","minLength":1,"maxLength":120},"capability":{"type":"string","minLength":1,"maxLength":120},"purpose":{"type":"string","maxLength":1000},"resources":{"type":"object","additionalProperties":{"oneOf":[{"type":"string","maxLength":500},{"type":"array","maxItems":100,"items":{"type":"string","maxLength":500}}]}},"query":{"type":["string","null"],"maxLength":2000},"requested_fields":{"type":"array","uniqueItems":true,"maxItems":50,"items":{"type":"string","minLength":1,"maxLength":120}},"pagination":{"type":"object","additionalProperties":false,"properties":{"page_size":{"type":"integer","minimum":1},"max_pages":{"type":"integer","minimum":1},"max_items":{"type":"integer","minimum":1}},"required":["page_size","max_pages","max_items"]},"sensitivity_ceiling":{"enum":["public","personal","confidential"]},"destination":{"type":"string","minLength":1,"maxLength":200},"payload_hash":{"type":["string","null"],"pattern":"^sha256:[a-f0-9]{64}$"},"created_at":{"type":"string","format":"date-time"}},
  "required":["schema_version","request_id","run_id","task_id","profile_id","workflow","connector_id","capability","purpose","resources","query","requested_fields","pagination","sensitivity_ceiling","destination","payload_hash","created_at"]
}
